{
    "ip_address": "0.0.0.0",
    "port": 8000,
    "database_path": "ingestion_system.db",
    "preparation_system_url": "http://10.0.0.1:8000/",
    "monitoring_system_url": "http://10.0.0.2:8000/",
    "min_transactions_per_session": 5,
    "max_invalid_attributes_allowed": 5,
    "execution_window_length": 5000,
    "monitoring_window_length": 50,
    "is_development_mode": true
}